{
  "schemaVersion": "agentdeploy.assetPack.v1",
  "id": "project-extension-pack",
  "title": "Project Extension Pack",
  "version": "0.1.0",
  "owner": "project-team",
  "stability": "beta",
  "reviewStatus": "reviewing",
  "packType": "project-local",
  "defaultProfileExtensions": {
    "developer": ["project-extension-pack-note-module"]
  }
}
